,replyToText
16170,Siamo una famiglia così...❤️#giorgia
21611,Il garante della privacy nel 2007 ha stabilito che tutti i possessori di case popolari devono essere resi pubblici... Ultimamente però la verità in alcuni programmi televisivi non è accettata
29046,"Che vergogna vivere in una Nazione in cui le forze dell’ordine non vengono rispettate, onorate, retribuite come meritano. Sempre riconoscente a chi ci protegge, sempre dalla loro parte! Polizia di Stato #VigiliDelFuoco

#difendiamochicidifende"
24429,"Il governo continua a cambiare idea dimostrando di non avere una visione industriale. 
Per quanto tempo dovremo continuare a sopportare questa incompetenza?"
21755,Mentre le nostre città sono flagellate dal maltempo il segretario PD se ne esce per l’ennesima volta con la proposta dello Ius Soli. ZINGARETTI SVEGLIA! Sei sicuro che sia questo ciò di cui gli italiani hanno bisogno?! #NoIusSoli
24767,"Fratelli d'Italia, Giorgia Meloni e il futuro del Centrodestra: ecco la mia intervista a Libero"
27810,"Cena degli auguri di Natale a Legnano, eravamo veramente in tanti. Grazie a tutti!! 
#FratellidItalia 🇮🇹

p.s. Tra poco a #DrittoeRovescio, mi seguite?"
26943,"Certo che schifosi sessisti questi uomini di destra... Ah no scusate è Vauro su Giorgia Meloni, va tutto bene."
19547,"Aveva picchiato brutalmente due donne in un sottopasso solo perché passavano di lì: “Assolto perché incapace di intendere e volere”. Uno scandalo! 

#tolleranzazero"
27686,Che farsa il voto sulla piattaforma Rousseau: con una manciata di voti hanno finto di far scegliere agli elettori i “neo-assunti” dal Movimento. Una cosa patetica. A questi bisogna spiegare cos’è la democrazia.
26777,"Dichiarato inammissibile l'emendamento-imbroglio che sfruttava la legge di Stabilità per reintrodurre la CannabisLight e il Governo si straccia le vesti. Io esulto. 
No alla droga e ai suoi surrogati sempre!"
29042,"Per Natale il Conte 2 ci rifila il pacco ma pieno di panzane. Giura che a Beuxelles va avanti un “pacchetto” ma il Mes va avanti senza nessuna tutela nè vantaggio per l’Italia. Speriamo la smettano con i regali...
#STOPMES"
27789,"Istruite ad aggirare la legge, fin da piccole ci deridono. Non temono la Giustizia che le lascia impunite. Se io non mando a scuola mio figlio minorenne mi viene tolto, alle rom non succede, anzi grazie ai bimbi escono di galera.

#TolleranzaZero"
27418,"Ieri ero ospite di Massimo Giletti nella trasmissione Non è l'Arena. 
Ecco i miei interventi su pressione fiscale, piccoli commercianti vessati e Governo allo sbando"
16794,A Bologna con Giorgia Meloni e Fratelli d'Italia a L’Italia che pensa in grande! Ci siamo!
16653,"Domani vi aspetto su La7 a L'aria che tira. 
Mi raccomando, seguitemi!"
22347,"Riguardo all’Ilva è sotto gli occhi di tutti che i 5 Stelle non abbiano una visione industriale, invece sul caso Trenta lascio a voi i commenti..."
27406,"Le persone che all’ospedale di Sondrio non hanno provato vicinanza per la madre che ha perso la sua bimba, che anzi l’hanno insultata, non hanno scusanti. Sono una vergogna sempre, e non ci rappresentano. L’Italia è infinitamente migliore!"
18480,Quasi tre milioni di richiesta risarcimento danni l’anno per le buche. Domanda al sindaco di Milano: converrà forse ripararle prima o continuiamo così?
645,"Attraverso piazza del Duomo per andare ad un appuntamento e guardate cosa trovo...🤦🏻‍♀️
Voi cosa ne pensate?"
24420,"‪La grande famiglia di Fratelli d'Italia non cessa di allargarsi! Oggi a #Milano abbiamo annunciato gli ingressi dell’assessore Pietro #Celestino e del consigliere #SilvaVidal del municipio IV. Porteranno avanti con noi le battaglie dei patrioti milanesi, lombardi, italiani!‬"
15825,Quando non si hanno argomenti si inventano le cose...
15476,"🔴 Giorgia Meloni smaschera Conte e i 5 Stelle sul MES, assolutamente da ascoltare! #StopMES"
487,"Finalmente sono riuscita a fare il Presepe, fatelo anche voi!

 #Natale #LeNostreTradizioni"
21477,Siamo alle comiche: Conte farà il più grande taglio di tasse? Nella manovra ce ne sono 10miliardi in più!
26765,Finito adesso si torna a casa e domani è sabato! Buonanotte amici #riposo #casa #amore
27815,Tutti per Giorgia Meloni questa sera a Firenze. Fratelli d'Italia c’è! 🇮🇹💪🏻
23368,"Conte all’oscuro del Parlamento e del popolo italiano ha dato l’ok alla riforma del #Mes, il Fondo salva stati che così renderebbe la Troika ancora più potente e invadente. Giorgia Meloni ha annunciato le barricate di Fratelli d'Italia,  noi siamo pronti! 
#StopMes"
18921,Buon sabato a tutti ❄️
24456,Siete d’accordo con me?
21434,"Danno tante lezioni, poi pur avendo (parole sue) due case di proprietà lei e il marito restano a carico dello Stato. Complimenti a Elisabetta Trenta tanto aggrappata ai privilegi che neanche capisce dove stia di “casa” l’imbarazzo. Anti-casta de che?!"
16377,"Oggi l’informativa al Senato di Conte sul MES non prevede il gettone di presenza, e nonostante l’importanza del tema in discussione, i banchi della maggioranza PD - M5S sono semivuoti. 
Che tristezza."
14347,"Auguri a tutti i Vigili del Fuoco, che oggi celebrano la loro patrona: Santa Barbara. Siete degli eroi quotidiani di cui l'Italia è orgogliosa!"
14814,"Commissari europei intonano ""Bella Ciao"". Solo io reputo scandaloso questo ridicolo teatrino da parte delle più alte istituzioni europee? 
Non hanno nulla di più importante di cui occuparsi?

Video di: Gardenia Trezzini"
27255,"Nel retroscena fornito dal Corriere della Sera sull’incontro a Roma con Casaleggio, le parole di Grillo fanno gettare la maschera al M5S: altro che alleanza di Governo per il bene della Nazione, sono incollati alle poltrone consapevoli di andare a casa in caso di elezioni. Tranquillo Beppe, potete rimandare la vostra sconfitta, ma arriverà presto il giorno in cui dovrete presentarvi al cospetto degli italiani. E quel giorno il popolo italiano vi ripagherà per tutti i vostri tradimenti 😉"
21993,I grillini gettano definitivamente la maschera e Beppe Grillo detta la linea a Luigi Di Maio: il M5S partito di sinistra alleato del PD. Fratelli d’Italia ha sempre avuto ragione a dire: mai col PD e mai col M5S.
19882,"Ora in diretta a ""L'aria che tira"". Seguitemi!"
27817,All'Ospedale Gaslini di Genova ricostruito il cuore di una bimba di 21 mesi affetta da una grave malformazione. I miei complimenti all'equipe medica per aver salvato questo angioletto e dimostrato ancora una volta l'eccellenza di un istituto all'avanguardia nella ricerca e nella cura dei più piccoli. Buona vita piccolina ❤️
16382,"Donazione semestrale del sangue: un piccolo gesto che non costa nulla, fa bene e aiuta tante persone. Fatelo anche voi, se potete. Complimenti all’AVIS per lo straordinario lavoro che da sempre fa."
22568,"🔵L’Italia che pensa in grande
Imprese, lavoro, infrastrutture - L'altra manovra possibile.

Vi aspettiamo il 1° dicembre alle ore 10:00 al teatro EuropAuditorium di Bologna per parlare della manovra economica, dando voce alle categorie produttive e presentando le nostre proposte, i progetti e i programmi per il rilancio della nostra Nazione e dell’Emilia-Romagna, un territorio che merita finalmente una guida all’altezza delle eccellenze e dell’operosità che da sempre lo caratterizzano. Non mancate!"
20052,"Ma davvero queste parole RAZZISTE e questo ragionamento MISERABILE di Corrado Augias possono essere considerati un pensiero autorevole? Sono schifata dal livello di bassezza a cui la sinistra italiana è arrivata, e considero scandaloso che si insultino così decine di milioni di italiani che votano a destra. Parlano con disprezzo di chiunque non la pensi come loro e poi fanno pure la morale. Che vergogna."
29140,"Mentre in Friuli-Venezia Giulia si discuteva la riforma sanitaria, il Pd si è superato e ha presentato questo folle emendamento per cancellare la parola ""famiglia"" e sostituirla con ""rete formale e informale della persona"". Ecco il testo: leggete voi stessi! Da non credere."
16086,"Ricordate la vicenda del calciatore accusato di fascismo per il simbolo sui parastinchi? In pochi minuti Alessio Sakara, campione italiano di arti marziali miste, vi spiega tutta la verità. A voler cercare fascismo ovunque, ecco le figuracce che si rimediano..."
24948,"Care sardine, ma non eravamo noi a diffondere odio come avete scritto nel vostro manifesto?"
23766,In diretta dal “Festival del Lavoro: anteprima 2020”. Seguitemi!
23408,"Buongiorno! Ore 21:45 sarò a Fuori dal Coro, su Rete 4. Seguitemi se potete."
23811,"Auguri a tutti i carabinieri che oggi celebrano la Virgo Fidelis, patrona dell'Arma. Grazie per la vostra fedeltà allo Stato e agli italiani!"
27290,"È normale che venga considerata ""una violenza inaudita"" chiedere di fare il Presepe nelle scuole? Mi aspetto da tutti coloro che considerano una minaccia le nostre tradizioni che siano coerenti e il 25 dicembre vadano a lavorare!"
16154,Chi l'avrebbe mai detto? 😏
16049,"Il M5S annuncia che voterà sì alla riforma del MES, il fondo salva-banche voluto dagli €urocrati. L'Italia aveva la possibilità di opporsi e alzare finalmente la testa, questa doveva essere la battaglia di tutti! Ma dai 5 Stelle arriva l'ennesimo voltafaccia, l'ennesimo tradimento fatto sulle spalle degli italiani per difendere le poltrone. Vergogna!"
27797,Buongiorno! Ore 20:30 sarò a “Stasera Italia” su Rete 4. Seguitemi se potete!
16121,Buongiorno a tutti! Vi ripropongo la mia intervista telefonica di poco fa a 24 mattino su Radio 24. Aspetto i vostri commenti.
16786,"Buongiorno! A partire dalle ore 21, sarò a “Tg2 Post”. Seguitemi se potete."
27809,"Buongiorno! Oggi appuntamento a Bari, ore 15.30, in piazza San Ferdinando. Vi aspetto!"
18008,"Nel disperato tentativo di distogliere l'attenzione dal Mes e dal loro ennesimo tradimento nei confronti degli italiani, il M5S sostituisce il PD con Fratelli d'Italia in un post in cui mostrano una rissa tra Partito Democratico e Lega avvenuta oggi in Aula. 
Accortisi della figuraccia nazionale, invece di rettificare, hanno preferito omettere ogni riferimento a partiti politici per non attaccare i loro alleati - direi padroni - del PD. Che fine triste."
27530,"Dopo aver proposto l'incredibile stanziamento di quasi mezzo milione di euro per finanziare il centenario del PCI, ora Pd e M5S vogliono farlo diventare anche anniversario nazionale. La nascita del Partito comunista come l'Unità d'Italia! Ecco le priorità di questo Governo..."
16609,Siamo andati a Bibbiano per primi e saremo gli ultimi ad andare via! E non smetteremo di parlarne finché non sarà fatta verità e giustizia per i bambini e le famiglie coinvolte. Non basta una denuncia per farci stare in silenzio.
27783,I carabinieri di Bologna in visita al reparto di pediatria dell'ospedale Bellaria per portare i doni natalizi e giocare con i piccoli pazienti. Complimenti per questo bellissimo gesto. I loro sorrisi valgono più di mille parole.
16810,"In una città dove i centri sociali fanno da padrone e occupano impunemente e illegalmente ogni genere di immobile, la priorità di De Magistris è quella di sfrattare la congregazione delle Suore Angeliche di San Paolo, che da 100 anni svolgono in maniera completamente gratuita assistenza ai bambini. 
Che vergogna! Napoli merita di più."
27537,"Viva Bari, viva la Puglia, viva l'Italia!"
24959,Sugar tax non ti temo
27050,"Politici, giornalisti, professori e intellettuali vari. Ormai la sinistra in totale subbuglio per la loro incapacità di visione e di proposte per la Nazione, passa il suo tempo a insultarmi pesantemente. Questa volta tocca a Michele Santoro che mi paragona a Hitler. A volte mi chiedo se siano coscienti di quello che dicono oppure se lo fanno solo per nascondere la loro inadeguatezza nel dare risposte ai problemi reali degli italiani. Ai loro insulti, noi rispondiamo lavorando ancora di più per il bene dell’Italia."
24965,"Tra pochissimo a Povera Patria su Rai 2. 
Mi seguite? 😊"
23688,"Comunico al Movimento 5 Stelle che non ho sbagliato giorno. Ribadisco che in Parlamento - al contrario loro - vado quasi tutti i giorni, anche se non si vota. A lavorare. 
Invece, i Cinquestelle confermano di venire in Parlamento solo quando si vota (PERCHÉ ALTRIMENTI TAGLIANO LORO LO STIPENDIO) cioè mediamente due/tre giorni la settimana. 
E tutti gli altri giorni che fanno? Misteri del grillismo."
24960,"Direzione Bologna: vi aspetto al teatro EuropAuditorium per l'evento ""L’Italia che pensa in grande"". 
Buona domenica!"
27267,"Le sardine sono un movimento spontaneo, apolitico... e quello in foto non è Nichi Vendola."
20039,"Le sardine dicono che non abbiamo il diritto di essere ascoltati e che dovremmo avere paura. Care sardine, tutti hanno diritto a farsi ascoltare. Il punto è: o si è convincenti con le proprie idee o non si può fare stare zitti gli altri. Chiaro?"
16720,"Ecco a voi le famose piazze delle sardine contro il ""linguaggio d'odio""🐟🤦🏻‍♂"
13824,"Ce l’abbiamo fatta, finalmente le atlete diventano professioniste!

Un altro passo è compiuto.

Adesso avanti con la battaglia sulla retribuzione: a parità di mansione, stesso salario per uomini e donne!"
21679,"Donne e non solo, in marcia per i diritti!"
7,"Se n’è andato uno degli ultimi testimoni dello sterminio ebreo ad opera dei nazisti

Un uomo che ha raccontato l’orrore di Auschwitz ai giovani

Una persona della quale ho apprezzato doti di umanità e intelligenza

Sono vicina alla famiglia di #PietroTerracina e alla comunità ebraica"
2006,"Liliana siamo con te, sempre al tuo fianco!

#LOdioNonHaFuturo"
22080,"Buona domenica Amici.
Ci vediamo questa mattina a Rimini?
Alle 11 sarò al convegno di Federanziani, con tanti nonni e nonne ai quali quel genio di Grillo vorrebbe togliere il diritto di voto. Alle 15.30 inaugurazione della sede riminese della Lega e poi direzione Fiorenzuola D'Arda (Piacenza) dove sarò alle 19. Avanti a testa alta, anche in Emilia-Romagna dopo 50 anni  sono convinto che, se ci impegniamo tutti insieme, la sinistra va a casa!
#26gennaiovotoLega"
14631,"Qui Catanzaro, all’inaugurazione della nuova sede della Lega. Seguiteci in diretta!
#26gennaiovotolega"
25124,"Che bello viaggiare in compagnia di personcine educate!
E poi magari vanno in piazza per combattere odio, violenza e maleducazione😂"
15774,"Buongiorno Amici! Stamattina Roma, oggi pomeriggio Romagna. Avanti tutta, #primagliitaliani 🇮🇹🔝"
22143,"Una delle “sardine democratiche” che sarà in piazza oggi a Modena contro di me, poco tempo fa invocava il mio omicidio da parte di un giustiziere e mi raffigurava a testa in giù.
Bella roba.
Aspetto reazioni indignate di giornalisti, politici e merluzzi... Viva Modena, viva l’Emilia-Romagna, viva la Libertà e la Democrazia, ma quelle vere😉"
14627,"Buongiorno Amici! Con il sorriso mio, di Lucia e di tutti noi che, a differenza del PD, non ci vergogniamo del nostro simbolo.
Idee chiare, coerenza, impegno, cuore e coraggio e l'Emilia-Romagna la liberiamo!
#26gennaiovotoLega
#BorgonzoniPresidente"
24624,"GRAZIE Fiorenzuola, GRAZIE Piacenza! ❤️
Oggi sul Carlino è uscito un sondaggio che ci dà in vantaggio di oltre 8 punti ma mi fido poco: i sondaggi che contano per me sono questi!
Cercheremo di meritarci tutto questo affetto, il 26 gennaio INSIEME possiamo cambiare l'Emilia-Romagna dopo 50 anni di sinistra.
E poi cambiamo l'Italia! 
Abbiamo meno di 70 giorni e OGNI VOTO CONTA!
Ci state? #26gennaiovotoLega
#BorgonzoniPresidente"
24899,"Tassa sulle lezioni di scuola guida, tassa sui lavori nei condomini, tassa sulle confezioni in plastica da 300 milioni, lotteria degli scontrini e nuova burocrazia da luglio, rinvio dei rimborsi a chi aspetta soldi dallo Stato.
E, per il terzo mese consecutivo, più sbarchi rispetto all’anno precedente.
Non molliamo e ritorneremo, promesso."
24255,"Non un grande buongiorno, Amici. Situazione disastrosa in Liguria, terremoto nella vicina Albania, a cui va tutta la nostra vicinanza e solidarietà. Tra poco, verso le 10, mi collego qui in diretta."
16459,"🔴PUR DI SALVARE LA POLTRONA, VOTANO SUL MES COL PD E HANNO IL CORAGGIO DI FARE LA MORALE AGLI ALTRI...

Se qualcuno ha tradito un ideale per salvare la poltrona, questi sono Grillo e Di Maio: da No al Mes a Viva il Mes, da Mai col PD a Viva il PD. Non si stupiscano se eletti ed elettori 5Stelle li mollano con Renzi e Zingaretti, e scelgono liberamente la Lega. La coerenza non è in vendita, ognuno raccoglie ciò che semina."
29172,"Questa mattina su Rai Radio1 ho ribadito che se oggi si parla di MES è solo grazie alla Lega che ha sollevato il problema.
Al governo qualcuno dice la verità, altri dicono bugie: chi ha ragione sull’attuale avanzamento dell’accordo, il signor Conte o il ministro Gualtieri???
#stopMES"
16231,"In diretta da Milano, state con noi!"
20485,"Ora su Rai Tre pare che il candidato del PD si sia dimenticato che al governo ci sono i suoi compagni di partito ☺️
#26gennaiovotoLega"
23123,"Una bella chiacchierata con Mario Giordano, buon pranzo Amici 😊"
16808,Da me e da Lucia Borgonzoni una serena e dolce notte! ❤️
22133,"Ancora una splendida domenica a voi da Rimini, Amici! Che tempo fa da voi?
Un pensiero a chi sta avendo enormi disagi a causa delle forti piogge, speriamo ci diano un po’ di tregua."
15463,"Avete seguito su Rai Tre?
Quanta pazienza che ci vuole 😇"
1871,"I sondaggi che contano! Sull’Appennino modenese in tantissimi mi hanno detto: “Votavo a sinistra ma questa volta voto Lega!”. Dai!
Il 26 gennaio liberiamo l’Emilia-Romagna, poi liberiamo l’Italia! 🇮🇹"
24040,"Solo 5 anni di galera per chi ha ammazzato un ragazzo, anche meno per i suoi complici, che schifo! Giustizia per Marco Vannini. Quarto Grado"
16776,"Direzione Appennino reggiano, alle 18.30 ci vediamo in piazza Martiri a Castelnovo ne’ Monti. Buon pomeriggio Amici."
16392,"🔴 Continuano litigi e scambio di accuse fra Raggi, sindaci del Lazio e Zingaretti. 
BASTA, i cittadini di Roma non meritano di essere seppelliti dai rifiuti per questi due incapaci!
Mandiamo a casa il duo sciagura e diamo a Capitale e Regione amministrazioni nuove ed efficienti.
#RaggiDimettiti #RomatornaCapitale"
25820,"Bloccata in Senato la vergognosa norma sulla coltivazione e la distribuzione di “droga di Stato”.
NO allo Stato spacciatore, la battaglia della Lega non si fermerà mai!"
24046,"⚠ Siamo allo Stato di polizia fiscale.
Dopo aver riaperto i porti e inventato tasse su plastica e zucchero ora il governo Pd-5Stelle-Renzi vuole pure entrare sul conto corrente degli Italiani. 
FOLLIA! La Lega è pronta a fermare questi matti."
16379,"Di fronte a “coglioncino” (può capitare!) ho cercato di rimanere impassibile!🤣
Comunque orgoglioso del mio...... maglioncino😃"
24391,"Ora in diretta da Fiorenzuola su Rete 4, chi c’è?"
24273,"Non permetteremo a nessuno di svendere la sovranità dell’Italia per qualche poltrona. Se avete qualche minuto, ecco la mia intervista di oggi su “La Verità”.
Buona serata Amici."
24605,"🔴”Lo Stato di primo contatto non può che identificarsi in quello della nave che ha provveduto al salvataggio”. Germania se batte bandiera tedesca, Norvegia se battte bandiera norvegese, ecc.
Finalmente un po’ di BUONSENSO."
14784,"🔴QUI SIAMO ALLA FOLLIA!!!
Bollinati come ""nocivi"" Parmigiano Reggiano, Pecorino Romano, salumi e olio d'oliva, promosse come ""sane"" ben note bevande zuccherate.
La Lega farà le barricate, l'unico ""semaforo rosso"" utile è quello per fermare questi matti."
24019,"Al governo abbiamo dei pericolosi incapaci detestati dalla maggioranza degli italiani.
A casa!
#noiussoli"
1393,"Buongiorno Amici! 
Si parte in treno da Lamezia Terme, tappa a Napoli (carcere di Poggioreale, per incontrare donne e uomini della Penitenziaria) e poi dritto fino a Milano, obiettivo compleanno di domani della mia Principessa😊"
22578,"++ PRIMA PARTE ++
Qui Roma, in diretta dalla Camera per presentare le proposte parlamentari della Lega su sicurezza, difesa e soccorso pubblico.
State con noi"
20215,"Verso le 21.30 mi collegherò con gli studi di Paolo Del Debbio su Rete 4, chi di voi ci sarà?"
16616,"Questo supera ogni confine di IDIOZIA: semafori rossi per metterci in guardia dai prodotti della dieta mediterranea, semafori verdi per bibite come la Coca Zero! Si può dire che il NUTRISCORE è una boiata pazzesca??? Fate girare perché non ne sta parlando nessuno."
16273,"Grazie Pavullo! ❤️
Dopo le mie visite alle aziende emiliane che resistono a Viano e a Rio Saliceto (Reggio Emilia), ci vediamo oggi pomeriggio a Ferrara: alle 16.15 al mercatino di Natale in corso Martiri della Libertà e alle 16.45 in galleria Giacomo Matteotti (cambio di location!).
#26gennaiovotoLega"
22357,"Trotta trotta cavallino. E io trotto! 😊
Buongiorno Amici ☀️, direzione Campania: ci vediamo alle 11 a Sorrento e alle 13 a Positano 🇮🇹"
24038,"Che meraviglia! 😻😻😻
Una piccola parte delle migliaia di vostri bimbi felini inviati, grazie! I #gattiniconSalvini terapeutici, portano gioia alla pagina e predispongono bene al sonno 😊
P.s. Potete creare un cartello personalizzato con i vostri mici andando su legaonline.it/gattiniconSalvini"
25863,"La battaglia della Lega continua anche a Bruxelles: difendiamo il Natale, difendiamo le nostre tradizioni!"
22849,"Buona guarigione a Mirò e GRAZIE per le migliaia di foto dei vostri mici che avete inviato, spettacolari! Le pubblicheremo!
I gattini sono intelligenti, puliti, liberi e portano bene☺️ 
Buonanotte Amici!
#gattiniconSalvini"
14723,"Ah beh, allora siamo a posto...! Complimenti a Pd e 5 Stelle per la scelta di Gentiloni come rappresentante dell’Italia in Europa, al prossimo giro canteranno anche Bandiera Rossa, poi Sanremo e tournée internazionale! 🙏"
23099,"Accidenti!😸
#gattiniconSalvini"
26572,"Lo sapete perché ci invidiano? Una comunità come la nostra se la sognano!
Buonanotte Amici, sempre con il sorriso e con la voglia di non mollare mai 😊"
18673,"Un saluto da Rimini con Lucia Borgonzoni e con tante nonne e tanti nonni 😊
#26gennaiovotoLega #BorgonzoniPresidente"
29211,"Mario Giordano chiarissimo sul MES, da ascoltare. 
#stopMES"
19652,"Oggi sono andato al carcere di Pisa, non per trovare i detenuti, ma per incontrare gli agenti della Polizia penitenziaria, visto che molto spesso vengono trattati peggio di chi sconta una pena, vengono ascoltati poco e fanno uno dei lavori più difficili."
29123,"Fortissimo Red Ronnie, parole di buonsenso! 🙂"
23149,"Il governo vuole svendere i risparmi in banca degli Italiani per salvare la poltrona?
Non glielo permetteremo."
25933,"Pizze per Fede e Mirta, tonno e cipolle e margherita, in arrivooo!"
26003,"Splendide emozioni oggi ad Aosta.
Non scambierei l’affetto e l’entusiasmo della nostra magnifica Comunità nemmeno per mille poltrone.
Grazie di esserci sempre, Voi siete la mia forza.
Buonanotte Amici, vi voglio bene 😊"
29201,La difesa è sempre LEGITTIMA. Punto.
18203,"Salvini spara agli immigrati...
Opera d’arte?
No, la solita schifezza di un sinistrato.
Intanto Raggi e Zingaretti litigano e Roma è sommersa dai rifiuti, Grillo e Di Maio non fanno più neanche ridere, Conte fa scappare aziende e approva trattati in silenzio, Renzi e Calenda fanno cose e fondano partiti.
Noi lavoriamo e non molliamo!
Buon sabato Amici😊"
16547,"Oggi al Villaggio degli Elfi, a parlare di LOL con mamme e papà😁
Buonanotte ❤️"
25320,"🔴Se per tenermi la poltrona io dovessi dire che Conte e Di Maio sono dei SEQUESTRATORI di persona, delinquenti che meritano fino a 15 anni di carcere, io non lo farei.
Onore e dignità ormai li hanno perduti del tutto.
Ma io mi rallegro lo stesso, perché so che posso contare su di VOI, Amici."
24571,"Ancora in diretta dalla Camera, state con noi. #stopMES"
16296,"I ""Kompagni"" a Vibo Valentia invocano il Vangelo per giustificare l'apertura dei porti... mi fate schifo! 
Il 26 gennaio, nonostante le minacce e gli insulti della sinistra, vinceremo per i calabresi.
#26gennaiovotoLega"
19820,"In diretta da Roma insieme alla squadra della Lega, state con noi! #Raggidimettiti #RomatornaCapitale"
15609,"EMOZIONANTE! Qui sulla montagna emiliana siete degli eroi, dimenticati da chi preferisce i salotti radical-chic ma sempre nel cuore della Lega.
Grazie Pievepelago ❤️
#26gennaiovotoLega"
24272,"Forza Sinisa, grande sportivo, vero Uomo."
16259,Sempre dalla parte di chi si difende.
15496,"Avete seguito su Rete 4, Amici? 
Queste piazze ""Bella Ciao"" contro di me in fondo mettono allegria! E poi con Prodi vanno sul sicuro 😀
#26gennaiovotoLega"
22689,"Dolce al limone di Positano, riduce i danni del governo ciarlatano!
Buonanotte Amici 😊"
29191,"Vi aspetto oggi alle 15 in diretta su Rai Tre da Lucia Annunziata. Se proprio non avete niente di meglio da fare, accendete 😊"
21017,"Crollato un viadotto autostradale vicino Savona, immagini terrificanti. Sembra non si sia fatto male nessuno e già questo sarebbe un miracolo.
Un abbraccio a tutti gli italiani colpiti oggi dalle disastrose conseguenze del maltempo.
Grazie a Vigili del Fuoco, Forze dell'Ordine, Protezione civile, volontari e a tutti coloro che anche queste ore, in tutta Italia, rischiano la vita per salvare quella degli altri."
29179,"La sinistra in Europa pensa ad un ""cordone sanitario"" per chi vota Lega e applaudire le nostre idee è vietato. Roba da matti!"
16787,"“Evasione fiscale indecente” denuncia il presidente Mattarella.
Vero.
Come è indecente che lo Stato debba ancora rimborsare 50 miliardi di euro a imprese e famiglie.
Come è indecente una tassazione che in tanti casi supera il 50% dei frutti del lavoro degli Italiani.
Questo sabato, 14 dicembre, la Lega organizza in tutte le regioni italiane il #NotaxDay, presto tutti i dettagli."
