,replyToText
17702,"ETEROGENESI DEI FINI

Secondo le femministe dei centri anti-violenza, per promuovere il rispetto bisognerebbe mettere il velo alle donne. A Lepanto, 500 anni fa, molti uomini europei morirono perché le loro donne potessero andare a capo scoperto, e così pure accadde sotto le mura di Vienna. E oggi queste pasionarie senza storia e senza radici vorrebbero islamizzare l'Italia nel nome del ""rispetto""? Anziché andare a fare le battaglie per la libertà della donna nei paesi islamici, vengono a legittimare l'Hijab? Chiedetelo a Hina Saleem, e vergognatevi, almeno un po'."
25397,"La ""colpa"" di Matteo Salvini è quella di aver difeso i nostri confini e di sostenere una linea molto chiara: in questo paese entra solo chi è in regola. Per questo rischia 15 anni di carcere. Assurdo è dire poco. Forza Matteo. #IoStoconSalvini"
15558,"Ho sentito che in parrocchia cantano ""BELLA CIAO"".."
17817,Io le sardine le preferisco così 😁
15594,"Si vergognino. Hanno tolto soldi a famiglie e imprese, urlano del fascista a tutti e poi buttano nel cesso 400 mila euro per celebrare gli orrori del comunismo. Che schifo."
15440,"Leggo che la scuola di Zerman rinuncia al presepe. Ogni anno è sempre la stessa storia. La decisione è stata presa ""nell'ambito di un progetto di inclusione sociale vergo gli alunni stranieri di fede diversa"". Vogliono cancellare le nostre tradizioni, vogliono cancellare le nostre radici. Con la scusa del multiculturalismo (modello fallimentare), sono pronti a cestinare la nostra storia. No cari miei, io non rinuncio a tutto questo. Giù le mani dal presepe."
13975,"Niente, non ce la fanno proprio. Gli estremisti rossi, i finti rivoluzionari, figli di papà, continuano a fare blasfemia contro la Vergine. Guarda caso, però, nei confronti dell'Islam queste orribili blasfemie non si sono mai arrischiate a farle questi signorini allergici a qualsiasi forma di rispetto. Cari miei, credetemi. Dovreste ringraziare ogni giorno di vivere in un paese con radici cristiane."
23219,"Carola Rackete sperona la motovedetta della Guardia di Finanza, rischiando di ammazzare i militari a bordo e viene applaudita dalla sinistra italiana e dal Parlamento UE. Matteo Salvini difende i confini del suo paese e viene indagato per sequestro di persona. Che schifo, è il minimo che si possa dire."
22360,"Hanno paura del voto perché vincerebbe Salvini. Almeno lo dicono alla luce del sole. Fanno l'ammucchiata al governo solo per impedire agli italiani di potersi esprimere liberamente. Italiani che non vedono l'ora di mandarvi a casa, caro Renzi."
25367,Cattive maestre. La sardine vi hanno proprio dato alla testa. Giù le mani dai bambini.
24666,"Gli scandali e gli orrori di Bibbiano hanno scosso i cittadini del paesino in provincia di Reggio Emilia. Ora la sinistra perde una fetta dei suoi elettori. A due mesi dalle elezioni in Emilia Romagna, ecco cosa pensano i cittadini di Bibbiano."
24308,"“Abbiamo poco tempo”, “Serve una politica più radicale per ridurre le emissioni”: quante volte sentiamo questi slogan? Per il professor Pedrocchi, professore emerito del Politecnico di Milano, l'uomo è ben poco responsabile del cambiamento climatico. La nostra vera sfida è semmai adattarci in un mondo che cambia naturalmente."
16697,"L'On. Cristina Rossello di Forza Italia parla di ""congelamento dell'odioso decreto Pillon"". Odioso. Addirittura. Lo sappiamo bene, l'affido condiviso, la bigenitorialità, il diritto dei bambini di crescere sia con mamma che con papà, anche quando sono separati o divorziati,  manda in tilt qualche ultra-femminista ideologizzata. Spiace constatare che l'onorevole azzurra continui a strizzare l'occhiolino al mondo ""progressista"". Ucci ucci, sento odor di Renzucci. Prossima tappa Italia Viva? Chissà.. 🤔"
1841,"Il Sindaco di Massa è stato aggredito a Firenze mentre si stava recando ad una cena elettorale. Nessuno si è indignato. Insieme a lui, sono state aggredite anche sua moglie, la figlia e l'assessore Veronica Ravagli. Nessuna femminista ha alzato la voce. Come mai? La violenza contro i leghisti è stata legittimata? Due pesi e due misure?"
25385,Pronto al test delle urine e a quello del capello. Poi andiamo a provare coi vostri 🤣
24671,"Col nuovo assessore alla Sanità della regione Umbria, l'amico carissimo Luca Coletto e gli amici On. Virginio Caparvi e On. Riccardo Augusto Marchetti. Buon lavoro Luca e auguri di cuore. C'è tanto da fare. Viva il nuovo governo dell'Umbria."
25947,"Ma un guardasigilli che si esprime sul contenuto degli atti di un procedimento giudiziario (atti che lui oltretutto non conosce), sta tentando di orientare qualcuno? Come che sia, questo è un abuso vergognoso."
25938,"Che vi dicevo? Distrutta la figura paterna e demolita la figura materna, ora si attacca la famiglia, destinata ad essere sostituita con le ""comuni polimaterne"". Ma cosa fuma questa gente?"
14309,Il gruppo della Lega Giovani dell'Umbria oggi è venuto a farci visita in Senato. I nostri giovani crescono e sono la classe dirigente del futuro. Forza ragazzi. Grinta e passione 💪🏻
587,"«Da sacerdote posso dire che le porte della mia chiesa sono sempre aperte per i poveri, perché quello dell’accoglienza è un principio importante. Però non si può nascondere il fatto che, tanto per fare un esempio concreto, qui a Bruxelles ci sono oltre mille senzatetto, provenienti da altri Paesi. Mi chiedo che senso abbia far venire qui delle persone per poi costringerle a vivere in queste condizioni. I fenomeni migratori vanno controllati: non si può accogliere tutti indiscriminatamente. E poi, anche chi viene accettato, è giusto che abbia ben chiara una cosa: deve rispettare le regole del Paese in cui arriva, non imporre le proprie"". Grazie per queste sagge parole, Don Carmelo."
19280,"Gratta Greta e trovi Malthus

Ero sicuro che la giovane norvegese fosse utile strumento nelle mani di chi pensa che l'umanità sia il cancro del pianeta. Ovviamente per umanità lorsignori intendono la plebe ridotta al rango di consumatori, utenti, defunti. Pochi figli, meglio se nessuno, basta coi voli low cost, coi viaggi, con le abitazioni riscaldate, con le bistecche, con la sanità universalista. Meglio garantire più gender, più aborto, più eutanasia, decrescita e vegetarianesimo per tutti. Il cancro si deve estirpare. Prime vittime saranno proprio questi inconsapevoli studenti, generazione erasmus che rischia di crescere senza radici, senza identità, senza genere.."
16518,Ecco come far perdere il posto ad altre migliaia di lavoratori italiani. Proprio un genio.
25704,Vi spiego in tre minuti che cosa si nasconde dietro il continuo attacco della sinistra nei confronti della casa.
15541,"Ecco la verità sul questionario gender per i ragazzi di terza media, che avevo denunciato già un anno fa. Alla fine lo hanno cambiato. Aveva ragione ""l'oscurantista e medievale"" Pillon? Pare proprio di si. Vittoria ✌🏻"
14391,"Il 75% degli italiani ha perso la fiducia negli altri. Questo è il dato centrale dell'ultimo rapporto Censis. La voglia di un uomo forte al potere solo una conseguenza, frutto dell'immobilità politica degli ultimi anni. Ma la soluzione alla sfiducia nelle istituzioni e alla deriva autoritaria esiste: basta con slogan e propaganda. Ricominciamo davvero a fare politica, a prendere posizione e a dare soluzioni. Chi governa deve smettere di fare vaghe promesse e iniziare a realizzare riforme per dare respiro ai cittadini e rilanciare il Paese. Noi ci stiamo provando: abbiamo detto dall'inizio di essere contro nuove tasse e ci siamo opposti all'aumento dell'IVA, a plastic tax, sugar tax, alla tassa sulle auto aziendali. Un passo alla volta, lavoriamo per riconquistare la fiducia dei cittadini."
26532,"In occasione del Natale, ho voluto fare ai dipendenti del Ministero gli auguri di persona, per ringraziarli dell'impegno che mettono ogni giorno nel loro lavoro. La Pubblica Amministrazione è spesso rappresentata come pesante, elefantiaca. Ma io ho trovato sempre persone appassionate e competenti, che hanno un forte senso dello Stato e lavorano per il Paese e per i cittadini. E allora siamo pronti a goderci questo Natale e recuperare le forze per impegnarci ancor di più e meglio per sostenere il futuro del nostro Paese."
21219,"La battaglia contro la violenza sulle donne non riguarda solo gli abusi fisici, è un problema culturale. Spesso le donne sono costrette a una condizione di inferiorità, sottomissione. Soffrono a causa di disparità economiche e sociali, a causa di abusi psicologici che costringono alla paura. La paura di dire no, di andarsene, di denunciare. La paura di essere libere. 
E allora dobbiamo combattere questa battaglia con forza. Portare avanti politiche che prevengano queste situazioni, educhino al rispetto e difendano le donne, i loro diritti e le loro libertà. Con Elena Bonetti siamo impegnate per aiutare tutte le donne vittime di violenza: 30 milioni per i centri antiviolenza, 1 milione per un sistema di microcredito che permetta alle vittime di ricominciare una nuova vita, lo sblocco dei fondi per gli orfani di femminicidio. 
Misure importanti, per una battaglia che dobbiamo vincere.

#LiberaPuoi #QualcosadiRosso #StopViolenzasulleDonne #GiornataControlaViolenzasulleDonne"
17866,"Anche a Modena, nonostante la pioggia, le sardine sono tantissime! Un banco coloratissimo sceso in piazza per manifestare contro odio e violenza, per libertà e democrazia."
13833,"No alla plastic tax, no alla sugar tax."
26605,"A Civitavecchia per la conferenza stampa di presentazione dell'operazione Mercato Globale su una delle navi del Corpo delle Capitanerie di Porto - Guardia Costiera specializzate nelle attività di controllo pesca. 
Il lavoro di contrasto alle frodi alimentari e per la tutela dei nostri mari svolto dalle donne e gli uomini della Guardia Costiera è fondamentale. Tutela i consumatori perché garantisce la sicurezza alimentare dei prodotti che acquistano, assicurandosi che siano rispettate tracciabilità e trasparenza. Tutela lavoratori e imprese, garantendo una concorrenza leale e maggiore certezza per quanto riguarda il loro reddito. E tutela anche i nostri mari, salvaguardando la biodiversità e vigilando sulla sostenibilità delle attività di pesca. La filiera italiana della pesca si afferma così come eccellenza, nella qualità, nel gusto e anche per la salute. E per questo, non possiamo che ringraziare chi si impegna ogni giorno in difesa del Made in Italy."
20118,"Ma davvero queste parole RAZZISTE e questo ragionamento MISERABILE di Corrado Augias possono essere considerati un pensiero autorevole? Sono schifata dal livello di bassezza a cui la sinistra italiana è arrivata, e considero scandaloso che si insultino così decine di milioni di italiani che votano a destra. Parlano con disprezzo di chiunque non la pensi come loro e poi fanno pure la morale. Che vergogna."
25513,Ma quante balle racconta Di Maio sulla vicenda gregoretti? O mentiva allora o mente oggi... voi cosa dite?
26856,"Annullare la messa di Natale “per rispetto delle minoranze” è un’idiozia e non solo perché non rispetta le nostre tradizioni cristiane, ma soprattutto perché impedisce a chi vuole integrarsi di conoscerci. 
La nostra cultura non offende!"
27119,"Quello che non mi è chiaro della simpatica ragazza nel video è: perché se tu sei fiera di essere islamica, io non posso esserlo di dirmi cristiana?"
23671,"Trasporta immigrati clandestini in Italia, viola i nostri confini e sperona una motovedetta della Guardia di Finanza. Risultato? Carola Rackete invitata in Rai come ospite d’onore da Fazio. Ma esattamente cosa vi hanno fatto gli italiani per essere presi in giro così?!"
26710,"Ecco chi diffonde davvero l’odio oggi! Santoro paragona Giorgia Meloni a Hitler (a Hitler!). E nessuno si scandalizza, che schifo."
25298,"""Salvini è un ignorante, chi sta con lui mi fa pena"".
Predicano tolleranza, ma solo per chi la pensa come loro.
Niente di nuovo: tipico atteggiamento da buonista di sinistra 😉"
25121,"Che bello viaggiare in compagnia di personcine educate!
E poi magari vanno in piazza per combattere odio, violenza e maleducazione😂"
19615,"Aveva picchiato brutalmente due donne in un sottopasso solo perché passavano di lì: “Assolto perché incapace di intendere e volere”. Uno scandalo! 

#tolleranzazero"
26957,"Certo che schifosi sessisti questi uomini di destra... Ah no scusate è Vauro su Giorgia Meloni, va tutto bene."
27068,"Politici, giornalisti, professori e intellettuali vari. Ormai la sinistra in totale subbuglio per la loro incapacità di visione e di proposte per la Nazione, passa il suo tempo a insultarmi pesantemente. Questa volta tocca a Michele Santoro che mi paragona a Hitler. A volte mi chiedo se siano coscienti di quello che dicono oppure se lo fanno solo per nascondere la loro inadeguatezza nel dare risposte ai problemi reali degli italiani. Ai loro insulti, noi rispondiamo lavorando ancora di più per il bene dell’Italia."
18196,"Un conduttore del servizio pubblico che omaggia in piedi una speronatrice di navi militari, è uno schiaffo a tutti i nostri uomini e donne in divisa e all’Italia intera. Ma solo io reputo questa scena una vergogna nazionale?"
20855,"Leader delle Sardine: “Io ritengo assurdo che si continui a parlare di Bibbiano”. 
E questo sarebbe un movimento apolitico? La triste realtà è che le sardine sono semplicemente la sinistra del Pd che scende in piazza senza bandiere... perché probabilmente se ne vergognano."
27231,"Non trovo parole per descrivere lo schifo contenuto in questo video. Spero solo che per questo miserabile che sale sulle vetture dei Carabinieri, sputando e gettandoci birra sopra, ci sia una pena esemplare. Magari così gli passa la voglia di fare il buffone oltraggiando lo Stato e le Forze dell'Ordine."
25645,La deputata britannica De Lucy gliele canta al presidente del Parlamento europeo David Sassoli (PD). Da vedere.
27474,"Don Albino Bizzotto non ha detto una parola su Bibbiano e ci viene a fare la morale sui rom; questa io la chiamo ideologia. E voi?

#DrittoeRovescio"
14023,"Guardate che schifezza. Ecco cosa sono capaci di produrre i collettivi di estrema sinistra a Bologna. Scopro su Facebook che hanno organizzato un party blasfemo contro la Vergine denominato ""Immacolata Contraccezione"". Offensivo per tutti i cattolici del nostro paese e non solo. Il tutto per attaccare me, Salvini e Fontana. Quanto sono tristi. Che peccato vedere gente senza ideali, che porta avanti solo cattiveria, provocazioni, insulti e blasfemie disgustose. E meno male che sarebbero loro i combattenti contro l'odio. Guardatevi allo specchio, ragazzi."
16319,"I ""Kompagni"" a Vibo Valentia invocano il Vangelo per giustificare l'apertura dei porti... mi fate schifo! 
Il 26 gennaio, nonostante le minacce e gli insulti della sinistra, vinceremo per i calabresi.
#26gennaiovotoLega"
26928,"Ci mancava la “sardina” musulmana col marito che inneggia ad Hamas, organizzazione terroristica che vuol distruggere Israele. Le Sardine sono la faccia peggiore della sinistra!"
17972,"Ricordiamolo sempre: la prima violenza sulle donne è quella islamica! 

#stopviolenzasulledonne"
472,C’è chi esulta per il primo bimbo con due madri biologiche. Nessuno si chiede se a quel bimbo mancherà un padre. Quando la finiremo di giocare a fare Dio?
14269,"Sono arrivati perfino a questo. Primo nato in Europa per ""gravidanza condivisa"" da parte di una coppia di donne in Gran Bretagna. Concepito con un ovulo della moglie Donna, prima di essere impiantato nell'utero di Jasmine, l'embrione è stato incubato per 18 ore nel corpo di Donna. Dove arriveremo di questo passo? Chiamatelo come volete, ma questo non è progresso. La vita umana è sacra. I bambini non sono cavie. E hanno il diritto di crescere con la mamma e il papà."
24249,"Giusto tenere agli atti, per la serie ""il mondo al contrario"": sulla tivù pubblica, pagata da tutti gli italiani, è andata in onda, accolta con tutti gli onori, una che se ne è infischiata delle nostre leggi e ha speronato una motovedetta della Guardia di Finanza rischiando di ammazzare gli occupanti. Messaggio di questa bella serata? L'Italia deve accogliere tutti, profughi, ""migranti economici"" ma anche i ""migranti climatici"" perché se in Africa ci sono sconvolgimenti ambientali è colpa nostra. Amen! 🙄"
20492,"Ecco a voi un corteo a Roma delle femministe di “Non una di meno”, indetto in vista della Giornata internazionale contro la violenza sulle donne. Ma avranno capito almeno per cosa scendono in piazza?"
27147,"Come la sardina in piazza si dice fiera di essere musulmana, io sono fiera di definirmi cristiana. L'unica differenza sta nell'ipocrisia di certa sinistra che passa il tempo a insultare me perché si vergogna della nostra cultura e delle nostre tradizioni."
14596,"‼️ “Simpatico” pesciolone-sandwich che oggi sull’Appennino reggiano mi ha invitato a buttarmi dalla Pietra di Bismantova (famosa, mi hanno detto, per i suicidi) con questo amorevole messaggio, direi quasi natalizio: “Ti offriamo un volo gratis, vediamo se sei uno STRONZO che sa volare o sai solo galleggiare”.
Ah, la democrazia, quella bella...!
Al loro odio risponderemo con il sorriso e la forza delle idee, e risponderanno i cittadini emiliani e romagnoli il 26 gennaio.
Buonanotte Amici, non si molla, e so che ci siete sempre! ❤️"
23523,"All'Eurosummit dello scorso Giugno il Presidente Conte ha dato l'ok alla riforma del Fondo salva stati (MES) senza coinvolgere il Parlamento, che entro il mese di Dicembre sarà chiamato a ratificare questa nuova eurofollia. La riforma del Mes prevede in sintesi una maxi patrimoniale per gli Stati che faranno richiesta di accesso al fondo ma che non rispettano i parametri stabiliti, e ovviamente l'Italia è fuori da questi. Il Mes si trasformerà in un super Troika onnipotente che avrà come unico scopo quello di agire nell'esclusivo interesse della speculazione finanziaria. Fratelli d'Italia annuncia sin da ora le barricate in Parlamento contro l'ennesimo atto di tradimento nei confronti del nostro popolo."
13880,"Sardine nere, bandiere rosse, diritti e documenti per tutti, stop ai Decreti Salvini. Se ne sentiva la mancanza..."
27185,Il sindaco Raggi rimuova IMMEDIATAMENTE questo schifo esposto al Museo di arte contemporanea di Roma. Non riesco a capacitarmi di come qualcuno abbia potuto autorizzare uno scempio di questa gravità all'interno di un museo comunale della Città Eterna. Questa vergogna deve sparire subito e i responsabili siano sanzionati.
22004,I grillini gettano definitivamente la maschera e Beppe Grillo detta la linea a Luigi Di Maio: il M5S partito di sinistra alleato del PD. Fratelli d’Italia ha sempre avuto ragione a dire: mai col PD e mai col M5S.
20581,"VERGOGNATEVI! FATE SCHIFO!
""Erano mercenari, noi le lacrime per i poliziotti uccisi non le versiamo"".
Queste le IMMONDE parole pronunciate a Trieste da quella bella categoria di ""persone"" che di solito vanno in piazza a lanciare pietre e bombe molotov agli ""sbirri"".
Un pensiero a Matteo e Pierluigi, eroi nazionali. Gli italiani perbene vi ricordano e vi porteranno sempre nel loro cuore."
17740,"Il diritto a una corretta informazione è un principio fondamentale che la stampa dovrebbe garantire a chiunque.

Quanto vale la parola di un conduttore televisivo che diffonde fotomontaggi?"
25112,"Ditemi voi se questa è “arte” o è solo una porcata!
Roba da matti, il manifesto per fortuna è stato rimosso dalla vetrina di un museo di Roma, ma l’autore meriterebbe due democratiche pedate nel sedere."
26287,"Anche oggi migliaia di Sardine in piazza San Giovanni, a Roma. Le piazze italiane sono sempre più piene: la voglia di libertà e democrazia sconfigge la retorica dell'odio.  #Romanonsilega"
26017,"""Gioielliere condannato a 13 anni per essersi difeso da un furto? Poteva comprarsi un pulsante per chiamare i carabinieri.""
Roba da matti. E poi si chiedono perché la gente non li vota più.
La difesa è sempre legittima!"
736,"Attraverso piazza del Duomo per andare ad un appuntamento e guardate cosa trovo...🤦🏻‍♀️
Voi cosa ne pensate?"
22524,"Ops, transatlantico deserto. Perché oggi non si vota e a chi manca non decurtano lo stipendio e non viene segnata come assenza. Tutti a casa di giovedì i moralizzatori grillini? Dai mi sento sola venite a farmi compagnia, assenteisti!
Capito perché il M5S ha bocciato la proposta di Fratelli d'Italia per fare timbrare il cartellino ai parlamentari?

Ps. Noi anche oggi al lavoro, tra poco illustriamo gli oltre 500 emendamenti alla manovra presentati da Fratelli d'Italia."
14653,"“Non piangerei se morisse Salvini”. Se questo è un prete... Una preghiera per lui, ne ha bisogno."
20885,"Ricordate il prete toscano che vorrebbe portare tutta l'Africa in Italia? Oggi concertino ""sardinante"" di ""Bella Ciao""... a Messa!
Tra un po' lo vedremo a Sanremo! 😀 (Roba da matti!)"
22726,"Ecco la democratica Samar Zaoui, una dei leader delle ""Sardine"". Qualche mese fa invocava la morte di Salvini su Facebook, scrivendo: ""Avremmo bisogno di un giustiziere sociale, di quelli che compaiono nella storia, che dopo aver ucciso vengono marcati come anarchici"". Il profilo di questa leoncina da tastiera è puntualmente scomparso da Facebook. Queste ""sardine"" le lasciamo volentieri al Partito Democratico."
25434,"OTTIMA NOTIZIA!
STOPPATO L'EMENDAMENTO CANNABIS. 
I RAGAZZI MERITANO SCUOLA E LAVORO E NON DROGA DI STATO

Ottima notizia la decisione della presidente Casellati di dichiarare l'inammissibilità dell'emendamento a firma Cirinnà, Mantero e altri che avrebbe di fatto liberalizzato la cannabis. I nostri ragazzi devono avere scuola, lavoro, ricerca, opportunità, e non si meritano di restare chiusi in un cesso a fumare la droga di Stato."
15742,"ROBA DA MATTI! 
Immigrati irregolari aggrediscono le nostre Forze dell'Ordine al grido di ""subito documenti per tutti"".
Ma per la sinistra la priorità dell'Italia è abolire i Decreti Sicurezza..."
25224,"Roba da matti.
Cantare “Bella Ciao” in chiesa una domenica sera, a Roma... Ma vi pare normale???"
15456,"Leggo che la scuola di Zerman rinuncia al presepe. Ogni anno è sempre la stessa storia. La decisione è stata presa ""nell'ambito di un progetto di inclusione sociale vergo gli alunni stranieri di fede diversa"". Vogliono cancellare le nostre tradizioni, vogliono cancellare le nostre radici. Con la scusa del multiculturalismo (modello fallimentare), sono pronti a cestinare la nostra storia. No cari miei, io non rinuncio a tutto questo. Giù le mani dal presepe."
26684,Buona domenica  #preparativipernatale ✨
13912,"Ma dove sono finite le femministe? Scomparse. Un po' di sana difesa delle donne non guasterebbe qua. O le donne sono solo quelle di sinistra? Se una donna si dichiara sovranista o leghista perde lo status di femmina? Dal silenzio pare proprio così. PS: Lucio Salis, il signore nella foto, dovrebbe essere un comico. Solo che non fa ridere."
21158,"Santificata in diretta tv, l’eroina della sinistra italiana, passata da un grande italiano come Berlinguer a una figlia di papà tedesca, predica che dobbiamo accogliere anche gli immigrati “climatici”... Poi si chiedono perché il PD abbia perso TUTTE le elezioni (politiche, europee, regionali) degli ultimi due anni. 
Non molliamo, Amici. Siamo nel giusto."
21125,"Questa sinistra è una vergogna anti-italiana: la cittadinanza non è un biglietto-premio al luna park, va meritata, desiderata, conquistata. #noiussoli"
1754,"🔴 ECCO IL VIDEO
A Padova completamente ubriachi rubano un’auto con un bimbo di 8 anni a bordo, il papà si aggrappa alla portiera per fermarli e si schiantano. Poteva essere una tragedia.
Ai Carabinieri che li arrestano hanno il coraggio di gridare: “Coglioni!”. Quanto rispetto, che bella “integrazione”...
Spero che qualche giudice dia a questi criminali la pena che meritano."
99,Condannato a 13 anni perché ha ucciso i rapinatori che hanno minacciato sua moglie. Non esiste nessun eccesso di #legittimadifesa! Difendersi da un’aggressione è un diritto! Vergogna! Giustizia per Guido Gianni
18345,"La battaglia contro la violenza sulle donne riguarda tutti noi: in media, ogni 15 minuti una donna è vittima di violenza di genere. Nel nostro Paese, ogni 72 ore una donna viene uccisa. Numeri spaventosi di una violenza che dobbiamo fermare, insieme. 
Per questo ho deciso di partecipare con tutto il Ministero delle politiche agricole alimentari e forestali alla giornata contro la violenza sulle donne. Esporremo un drappo rosso sulla facciata, e ho chiesto a tutti i lavoratori del ministero di indossare #QualcosadiRosso. Lo stesso farò io.
Un gesto simbolico, che ribadisce l'impegno doveroso delle istituzioni per tutte le donne vittime di abusi e violenza.
#LiberaPuoi ricominciare!

https://www.politicheagricole.it/flex/cm/pages/ServeBLOB.php/L/IT/IDPagina/14711"
18268,"L’eccitato Fazio avrà il “piacere e l’onore” di ospitare a vostre spese la signorina Carola.
Nota bene: se non speronate navi militari italiane non fatevi nemmeno avanti, nessun invito...!"
25940,"Che vi dicevo? Distrutta la figura paterna e demolita la figura materna, ora si attacca la famiglia, destinata ad essere sostituita con le ""comuni polimaterne"". Ma cosa fuma questa gente?"
26994,"Nonostante le giornate di lavoro infinite e la stanchezza, faccio di tutto per non saltare i miei allenamenti.
Grazie @annarivieri per gli allenamenti sempre sfidanti."
23362,"Nei cortili di Milano macellerie abusive. Uno si affaccia al balcone e gli stanno macellando un animale sotto le finestre. A denunciare ancora una volta Fratelli d'Italia  e lo ricordiamo: suolo italiano regole italiane! 

#tolleranzazero"
