,replyToText
14333,"Avevamo chiesto un fondo per sostenere le giovani famiglie, quei giovani eroi che ancora hanno il coraggio di sposarsi e di mettere al mondo figli in una società che è ferocemente contraria alla vita e alla famiglia. Ci è stato detto di no. Avevamo chiesto un fondo per la natalità. Ci è stato detto di no. Avevamo chiesto ausili per evitare che i figli siano tolti dalle famiglie per ragioni economiche, perché non si ripetano più orrori come quelli successi a Bibbiano. Ci è stato detto di no. E avete detto no anche all'installazione di telecamere nel momento in cui vengono ascoltati i minori. E in questo modo avete difeso il sistema. Complimenti."
24858,"🔴CHE SCHIFO!
Arrestato un ""richiedente asilo"" nigeriano per aver sequestrato, picchiato e stuprato una ragazza di 22 anni nei locali gestiti da una cooperativa di ""accoglienza"".
Peter Chiebuka amava le Porsche, i vestiti firmati e le collane d'oro, che esibiva sui social.
E poi dicono che ""Salvini è cattivo""... MA DA QUALE GUERRA SCAPPA?
Spero si faccia piena luce sulla condotta di questa coop e che l'infame paghi fino in fondo per quello che ha fatto."
24999,"Diamo voce e spazio al grido di dolore dei commercianti di Firenze: ""Siamo ostaggio di clandestini violenti, rapinatori, spacciatori, drogati"". E poi è Salvini il cattivo..."
23104,"Indovinello: con la complicità del governo, dove sbarcheranno queste centinaia di immigrati??? 🤔"
25119,Bimba felice con regalo😊
27534,"Dopo aver proposto l'incredibile stanziamento di quasi mezzo milione di euro per finanziare il centenario del PCI, ora Pd e M5S vogliono farlo diventare anche anniversario nazionale. La nascita del Partito comunista come l'Unità d'Italia! Ecco le priorità di questo Governo..."
26152,"L'Italia è la capitale mondiale del volontariato, e chi scappa veramente dalla guerra è il benvenuto.
Ma se arrivi nel nostro Paese e non ti va bene il presepe o il cibo te ne torni da dove sei venuto, perché non dobbiamo essere noi a cambiare la nostra cultura e le nostre tradizioni. Punto.
Ecco la mia intervista con Massimo Giletti, buon pranzo Amici."
24595,Forse chi si permette di insultare gratuitamente e quotidianamente la Lega potrà trarre insegnamento da questo esempio.
23423,"Ora in diretta su Rete 4 a ""Fuori dal Coro"". Mi seguite?"
