,replyToText
23339,"Fazio non tradisce la radice del cognome e si conferma fazio-so, invitando con tutti gli onori Carola Rackete, una ragazzina che più volte ha violato le nostre leggi addirittura speronando una motovedetta della Guardia di Finanza. 
Io non ci sto, e farò un'interrogazione parlamentare in merito!"
23319,"Picchiava i bimbi. All’arresto: “nel mio Paese si usa così, non sapevo qui fosse reato”. Ed è esattamente questo il punto: gli Imam e chi li segue devono far propria la nostra cultura e le nostre leggi o qui non ci devono stare! 

 #tolleranzazero"
25392,Pronto al test delle urine e a quello del capello. Poi andiamo a provare coi vostri 🤣
25374,Cattive maestre. La sardine vi hanno proprio dato alla testa. Giù le mani dai bambini.
25909,"Vorrebbero cancellare il Decreto Sicurezza, vorrebbero impedire a chi fa politica di parlare in televisione, cercano fascisti e razzisti dove non ce ne sono, insultano il sottoscritto un giorno sì e l’altro pure.
Altro che “democratici”, a me sembra un atteggiamento da censura!"
25950,"Ma un guardasigilli che si esprime sul contenuto degli atti di un procedimento giudiziario (atti che lui oltretutto non conosce), sta tentando di orientare qualcuno? Come che sia, questo è un abuso vergognoso."
14380,"Un abbraccio, Valentina. Se questo è il tuo unico “desiderio” temo che Babbo Natale non ti accontenterà😊"
1775,"La battaglia per l'ambiente e per ridurre gli sprechi passa anche dai nostri piccoli gesti quotidiani. Io per esempio ho comprato una bella borraccia, così da ridurre l'uso di bottigliette di plastica."
14717,"🔴Reddito di cittadinanza sempre più vergognoso. 
Non contenti di distribuire i soldi degli italiani perbene a spacciatori, nomadi, ex brigatisti, criminali vari e lavoratori in nero, adesso rendono ancora più facile, a più di 3 milioni di stranieri extra Ue presenti in Italia, richiedere il reddito di cittadinanza. Ora basta! Aboliamo questa misura assurda e aiutiamo solo i veri bisognosi."
22930,"Il Movimento 5 Stelle è arrivato alla frutta! Per tentare di distogliere l'attenzione dai loro disastri, scandali e continui tradimenti nei confronti degli elettori, ormai attaccano e diffondono quotidianamente falsità su di me e Fratelli d'Italia. Qualcuno può informarli che stanno al governo e non all'opposizione?"
17830,Io le sardine le preferisco così 😁
16189,"Il leader delle Sardine ( movimento spontaneo 🙄 e a-partitico) sarà in piazza con Bonaccini...il pesce dopo tre giorni puzza.

#elezioniregionali #EmiliaRomagna"
25237,Si riparte direzione Roma! Speriamo di avere una vicina di volo educata😉
23114,"Ormai il giochetto si è capito: gratta la sardina trovi la piddina. E questa “democratica”, assessore in un comune della provincia di Bologna, dice anche che siamo dei “delinquenti prestati alla politica”...
Amici, più ci insultano, più vinciamo!
#26gennaiovotoLega"
22041,"Prodi dice che non c'entra niente con le sardine. Gli crediamo. D'altronde lui dice sempre la verità. Come quando ha promesso che con l'euro saremmo stati più ricchi. È andata così, no?

Le vignette di Krancic"
25173,"Che tristezza. Se questo è il modello di integrazione, altro che cittadinanze italiane in regalo come vorrebbe il PD... #NoIusSoli"
24860,"Questa mi mancava: l'eroina della sinistra che ha speronato la Guardia di Finanza mi denuncia per “istigazione a delinquere”...
Roba da matti! 
Noi sorridiamo e controdenunciamo, contando di incontrare questa signorina in Tribunale 😘"
22920,"Presentato emendamento di Fratelli d’Italia alla manovra per richiedere un deposito cauzionale di 30 mila euro agli extracomunitari che vogliono aprire un'impresa in Italia e che saranno scalati dalle tasse dovute. STOP alla concorrenza sleale dei negozi gestiti da extracomunitari che non pagano le tasse, come mini market e negozi cinesi. Difendiamo le attività italiane che continuano a chiudere strozzate dalle tasse!"
23346,"Arrestato originario del Gabon per aver stuprato ragazza fuori da nota discoteca di Milano. 
Che città è quella in cui non possiamo più neanche mandare i nostri figli a divertirsi in sicurezza?! 
Sala sveglia!!"
17706,"ETEROGENESI DEI FINI

Secondo le femministe dei centri anti-violenza, per promuovere il rispetto bisognerebbe mettere il velo alle donne. A Lepanto, 500 anni fa, molti uomini europei morirono perché le loro donne potessero andare a capo scoperto, e così pure accadde sotto le mura di Vienna. E oggi queste pasionarie senza storia e senza radici vorrebbero islamizzare l'Italia nel nome del ""rispetto""? Anziché andare a fare le battaglie per la libertà della donna nei paesi islamici, vengono a legittimare l'Hijab? Chiedetelo a Hina Saleem, e vergognatevi, almeno un po'."
25263,"Mi sembra un'assurdità e una vergogna, credo che di questo si rendano conto milioni di italiani.
Per la mia coerenza rischio un processo, ma non rischio di perdere la dignità!
GRAZIE Amici, il sorriso non lo perdo. Vi voglio bene❤️"
23476,"Dopo lo scandalo della casa a cui non voleva rinunciare, ora si aggiunge la scorta con l'auto blu (pagata dai contribuenti) al cane dell'ex Ministro Trenta. Alla faccia della lotta ai privilegi del M5S! 🤣"
27507,"La satira è sempre legittima e sacrosanta, ma tentare di ridicolizzare uno scandalo che ha rovinato la vita di tanti genitori e bambini, per il semplice gusto di attaccarmi, è veramente qualcosa di ripugnante. Che pena."
22446,"Se non riesci a pagare una multa e ti entrano nel conto corrente per pignorarti i risparmi, siamo all'Unione sovietica fiscale, lo Stato di polizia fiscale. Questi sono pericolosi."
26413,"L'origine delle materie prime in etichetta deve essere obbligatoria per tutti gli alimenti, anche in Europa. L'ho ribadito durante il mio intervento di oggi al Consiglio dei Ministri di Agricoltura e Pesca. Trasparenza e informazione sono un diritto dei cittadini. Per questo insieme ai colleghi di Francia, Spagna, Portogallo e Grecia abbiamo chiesto alla Commissione Ue di rafforzare la legge europea sull'etichettatura. E credo sia positivo che molti Stati Membri abbiano concordato con la nostra posizione. Non c'è tempo da perdere. L'etichettatura non può essere facoltativa e la sperimentazione che è in corso in molti Paesi su latte, formaggi, carni trasformate, pasta, riso, pomodori, non può concludersi. Lavoriamo insieme rapidamente, affinchè anche su questi prodotti ci sia l'obbligo di indicare l’origine della materia prima. Per introdurre questa norma, che è una norma di buonsenso, non è certo il caso di attendere un nuovo scandalo alimentare.
Inoltre, il sistema di etichettatura deve essere completo e dare informazioni nutrizionali corrette. I sistemi di etichettatura con bollini rossi non ci piacciono, discriminano tanti prodotti della dieta mediterranea.  Come possiamo dire di promuovere la qualità dei territori con le DOP e IGP, se poi sulla confezione insieme al marchio di qualità europeo si trova un bollino rosso di bocciatura? Non è accettabile. 
In Italia stiamo completando la sperimentazione di un sistema a batteria che dica al consumatore quale percentuale di fabbisogno giornaliero degli elementi nutritivi ha raggiunto. Dobbiamo guardare allo stile alimentare, a un equilibrio per le diete sane. E l'Italia, che insieme al Giappone è uno dei Paesi con la maggiore longevità al mondo, ha qualcosa da dire sulla materia."
23243,"L'urgenza del PD? Lo Ius Soli per svuotare il valore della cittadinanza italiana, svenderla e trasformarla in un automatismo, come se fosse una marchetta. Zingaretti, la cittadinanza non si regala, si merita dopo un ragionevole e chiaro percorso formativo. Ancora una volta il Partito Democratico ha priorità diverse da quelle degli italiani."
26792,"Dichiarato inammissibile l'emendamento-imbroglio che sfruttava la legge di Stabilità per reintrodurre la CannabisLight e il Governo si straccia le vesti. Io esulto. 
No alla droga e ai suoi surrogati sempre!"
27379,"SCANDALOSO! Di Maio sta usando le istituzioni per ripicche personali. 
Per Fratelli d'Italia gli unici che dovrebbero essere indagati sono quei ministri che per anni hanno fatto favoreggiamento dell'immigrazione clandestina!"
27271,"Le sardine sono un movimento spontaneo, apolitico... e quello in foto non è Nichi Vendola."
18766,"Altra ONG straniera, altro sbarco, altro regalo.
Appena torniamo al governo, tornano a valere regole, controlli e serietà. #portichiusi"
18814,"🔴Se questa è un'""opera d'arte""... A me non fa ridere, nemmeno per un cazzo. Si può dire? Me lo consentite? Con certe cose non si scherza."
22213,Il Movimento 5 Stelle tenta di distogliere l’attenzione dai suoi continui fallimenti e tradimenti nei confronti degli italiani diffondendo falsità su Fratelli d’Italia. Ascoltate bene e fate girare!
20048,"Le sardine dicono che non abbiamo il diritto di essere ascoltati e che dovremmo avere paura. Care sardine, tutti hanno diritto a farsi ascoltare. Il punto è: o si è convincenti con le proprie idee o non si può fare stare zitti gli altri. Chiaro?"
19791,"Oggi a Civitavecchia non ho capito l'attinenza fra il problema della discarica e ""Bella Ciao""...
Comunque grazie ai ""democratici"" per bandiere rosse, pesciolini vari, ""SALVINI MERDA! Salvini fai schifo! Salvini fai vomitare!"".
La musica è sempre la solita, Amici, ma non ci spaventiamo: avanti a testa alta, un bacione a chi ci vuole male 😘"
20890,"Capito? Siete/siamo tutti dei gran ignoranti. ovviamente!
Più che ""destra"" o ""sinistra"", io vedo da una parte un'Italia di Buonsenso che ama il proprio Paese, dall'altra i soliti tromboni pieni di boria che schifano chi non la pensa come loro."
26732,È successo anche a voi??? #treno #Napoli #milano
24461,"Padova, scuola di Corano per bimbi: il primo iman, socialmente pericoloso, è stato rimpatriato il 20 novembre. Il secondo, chiamato a sostituirlo, è stato arrestato per maltrattamenti agli allievi. E la domanda è: perché nessun genitore ha denunciato?"
22149,"Una delle “sardine democratiche” che sarà in piazza oggi a Modena contro di me, poco tempo fa invocava il mio omicidio da parte di un giustiziere e mi raffigurava a testa in giù.
Bella roba.
Aspetto reazioni indignate di giornalisti, politici e merluzzi... Viva Modena, viva l’Emilia-Romagna, viva la Libertà e la Democrazia, ma quelle vere😉"
20915,"Padre Sorge spara a zero contro l'apertura al dialogo del Card. Ruini e si accanisce contro Matteo Salvini. Ormai è diventato uno sport nazionale. Grazie a Dio però, ci sono ancora tanti sacerdoti che non fanno tifo politico spostato a sinistra come Sorge, ma che sono rimasti lucidi e capaci di dare un giudizio alla luce della fede."
16071,"David Parenzo può dire e fare quello che vuole, ma la posizione di Fratelli d’Italia è chiara."
27807,"«È proprio un Paese di handicappati l'Italia. Però è un paradiso per gli zingari» ‬
‪Ecco cosa si dicevano i Rom arrestati per organizzare borseggi nella metro di Milano. ‬
‪Subito in galera e buttare via la chiave! ‬#TolleranzaZero"
16162,Chi l'avrebbe mai detto? 😏
27561,Metto il casco e si parte!!
24547,"🔴 MA COSA CI PUÒ ESSERE DI PIÙ ASSURDO???
In una scuola elementare in provincia di Treviso le maestre avrebbero deciso di rinunciare al presepe perché offende bimbi di altre religioni. Se è vero, siamo di fronte all’ennesima idiozia!!!
Come si può pensare che i simboli più amati della nostra civiltà, segni di pace e di fratellanza, possano offendere qualcuno?
GIÚ LE MANI DAL NATALE!
P.s. Segnalatemi altri casi come questo, se serve andrò anche di persona a visitare queste scuole."
24812,"Popolari, socialisti, verdi, grillini e comunisti votano insieme e bocciano la risoluzione presentata da Fratelli d’Italia in Parlamento europeo sui diritti del bambino. Hanno detto no alla difesa della vita fin dal concepimento, no al sostegno alla famiglia naturale e a misure per conciliare vita-lavoro e garantire un ambiente sano ai minori, no alla lotta alla diffusione dell’ideologia gender nelle scuole, no alla condanna di una pratica barbara come l’utero in affitto. Approvata, invece, una folle risoluzione per spingere gli Stati ad introdurre lo ius soli e che parla, quasi in ogni capoverso, di LGBTI. Questa non è la mia Europa."
25345,"Che Gesù Bambino sia di pelle bianca o nera, per me fa lo stesso, l’importante è che asili e scuole abbiano un bel Presepe e festeggino il Santo Natale con tutti i bambini. 
Mi sembra invece strana l’assenza di Maria e Giuseppe, quasi Gesù non avesse madre o padre, quasi che il concetto di “famiglia” desse fastidio a qualche radical chic di sinistra. 
Sui morti nel Mediterraneo infine, sono orgoglioso che durante i miei mesi da ministro il numero di annegati e dispersi si sia ridotto enormemente, grazie al controllo di partenze e sbarchi. 
Buon Santo Natale a tutti ricordando, come diceva San Giovanni Paolo II, che l’Europa è cristiana!"
25411,"La ""colpa"" di Matteo Salvini è quella di aver difeso i nostri confini e di sostenere una linea molto chiara: in questo paese entra solo chi è in regola. Per questo rischia 15 anni di carcere. Assurdo è dire poco. Forza Matteo. #IoStoconSalvini"
25067,"Inchiesta vergognosa: quanto costa ai cittadini italiani questa caccia alle streghe in termini di uomini, spreco di tempo e utilizzo di mezzi? Indagato perché ho difeso la sicurezza, i confini e la dignità del mio Paese, incredibile."
27710,"E anche questa volta le promesse del M5S vengono meno. A rimetterci sempre gli italiani perbene che fanno sacrifici per andare avanti, mentre ex brigatisti e condannati vari vengono coccolati dal Governo pentapiddino."
15871,"Una canzone che ha unito l’Italia migliore e continuerà a unirla, nel segno della libertà. 

Cantiamola insieme, più forte ancora! 

#BellaCiao"
13860,"Che bellezza, Siena!"
2113,"Quando una certa parte della sinistra non ha fiducia nella democrazia, ricorre all’odio e alla violenza fisica.
Purtroppo è una storia già vista ed è richiesta la massima vigilanza da parte di tutti.
Questo non è dibattito di idee, anche acceso: questo è NAZISMO ROSSO.
Ancora solidarietà al nostro sindaco, all’assessore e ai loro famigliari vigliaccamente aggrediti (non solo a sputi) ieri sera a Firenze. Noi andiamo avanti a testa alta, armati di sorriso e di fiducia nei nostri progetti di Buongoverno per l’Emilia-Romagna, la Toscana e per tutta Italia.
Non si molla, per il bene del nostro Paese e dei nostri figli 🇮🇹
Ci state, Amici?"
2078,"🔴Stop Mes: replica al premier Conte.
Seguitemi in diretta dalla Camera dei Deputati."
22168,"""Sovranisti? Dei virus da tenere a bada.""
Ma pensa! 
Purtroppo per il presidente del Parlamento europeo (del Pd), la sovranità appartiene al Popolo e al libero, democratico esercizio delle elezioni.
Così come l'hanno sperimentato in Umbria, lo vedranno il 26 gennaio in Emilia-Romagna e in Calabria 😉"
13888,"Se ne sentiva la mancanza, effettivamente! Sono arrivate le “sardine nere”: vogliono i documenti e l’abolizione dei Decreti Salvini 🤔"
15436,"Grazie al Partito Democratico in tutti questi anni ho appreso di essere il ""genitore 2"" di tre ""prodotti del concepimento"" della mia ""rete formale e informale della persona"". Ma, ovviamente, il gender e i progetti di decostruzione della famiglia non esistono. Posso dire una cosa agli amici del PD? Ma vedete di andare a compiere attività ludico-ricreative da tergo!"
27805,"L’Eurabia che aveva profetizzato Oriana Fallaci è già in atto? Ne parlerò domani a Codogno (Lodi), vi aspetto!"
14730,"Ah beh, allora siamo a posto...! Complimenti a Pd e 5 Stelle per la scelta di Gentiloni come rappresentante dell’Italia in Europa, al prossimo giro canteranno anche Bandiera Rossa, poi Sanremo e tournée internazionale! 🙏"
24453,"In Italia ci sono delle leggi da rispettare, non devono esistere repubbliche rom dove ognuno fa quel che vuole. Siete d’accordo?"
1722,"Per carità, satira e ironia sono il sale della vita, ma perché tirare in ballo la Madonna???"
25279,"Da quando sono segretario della Lega ho sempre promesso che una volta al governo avremmo bloccato gli sbarchi: l'ho fatto da ministro e, se gli Italiani mi sceglieranno ancora, lo rifarò. Punto.
Ecco la mia intervista su La7 con Myrta Merlino."
16091,"Ricordate la vicenda del calciatore accusato di fascismo per il simbolo sui parastinchi? In pochi minuti Alessio Sakara, campione italiano di arti marziali miste, vi spiega tutta la verità. A voler cercare fascismo ovunque, ecco le figuracce che si rimediano..."
20209,"++ 🔴 SCHIFOSI! ++
Alla faccia della democrazia, ecco chi semina odio...
Qui a Firenze, dove mi trovo, aggrediti il sindaco di Massa, Francesco Persiani, con figlia e moglie, e l’assessore Veronica Ravagli, che è stata anche scaraventata a terra, tra sputi e insulti. A loro il mio abbraccio.
Andremo avanti più forte di prima, il vostro odio non ci fermerà!!!"
20201,Compagni milionari......
27791,"Istruite ad aggirare la legge, fin da piccole ci deridono. Non temono la Giustizia che le lascia impunite. Se io non mando a scuola mio figlio minorenne mi viene tolto, alle rom non succede, anzi grazie ai bimbi escono di galera.

#TolleranzaZero"
19215,"Vi ripropongo la mia intervista di ieri sera da Bruno Vespa a ""Porta a Porta"". Come sono andata? Aspetto i vostri commenti."
25357,"🔴 Vergogna, incredibile vergogna!
La mia solidarietà a tutti i bimbi, agli insegnanti e ai genitori a cui viene negato il bello del Natale, nel nome di un’inaccettabile sottomissione culturale e valoriale. 
Invierò personalmente un presepe a questa preside, che evidentemente ha fallito nella sua missione educativa."
20032,"I giudici ci danno ragione sulle Ong, non ditelo a PD, Carole e carolanti vari! L'Italia rialza la testa, è solo BUONSENSO! 🇮🇹"
27318,"L'ok di Di Maio all'autorizzazione a procedere contro Salvini per sequestro di persona mostra la vera natura ""bifronte"" del M5S, capace di voltare le spalle ad ex alleati ed elettori a seconda della convenienza. Ecco perché Fratelli d'Italia non vorrà mai avere nulla a che fare con questa gente!"
232,"Se questa è ""giustizia""...
La difesa è sempre legittima!"
635,"Mi è arrivata la denuncia di Carola Rackete per “istigazione a delinquere e diffamazione”..!!🤣
Per addolcire la giornata, una fetta di pane e Nutella con una richiesta alla Ferrero: comprate ingredienti italiani, dallo zucchero alle nocciole, per aiutare i nostri agricoltori!
P.S. Domani Lega in oltre 1.200 piazze italiane, vi aspettiamo: #stopmes"
20474,"++ CHIESTI 17 ANNI DI GALERA! ++
Uccise due rapinatori e ne ferì un terzo, dopo che avevano aggredito e minacciato lui e la moglie con una pistola, poi risultata finta.
La “giustizia” italiana chiede una condanna a 17 anni di galera per questo commerciante siciliano di 58 anni.
Io invece sto con lui.
#iostoconGuido"
991,"Evviva, sono riuscita a fare L’ albero di Natale con il grande aiuto di Dimitri #amore #natale"
1362,"🔴In diretta dal Senato, la mia risposta al nervoso ex avvocato degli Italiani #stopMES.
Decine di assenze fra i 5Stelle (oltre 30) e a sinistra (oltre 20) mentre parla Conte. Neanche la sua maggioranza lo ascolta.."
27263,"Nel retroscena fornito dal Corriere della Sera sull’incontro a Roma con Casaleggio, le parole di Grillo fanno gettare la maschera al M5S: altro che alleanza di Governo per il bene della Nazione, sono incollati alle poltrone consapevoli di andare a casa in caso di elezioni. Tranquillo Beppe, potete rimandare la vostra sconfitta, ma arriverà presto il giorno in cui dovrete presentarvi al cospetto degli italiani. E quel giorno il popolo italiano vi ripagherà per tutti i vostri tradimenti 😉"
29048,"Non è la prima volta che si verifica un incidente sulla metro a Milano. I precedenti sono tanti, ormai non si può più parlare di casualità.
Troppi incidenti e scarsa sicurezza, Beppe Sala ci sei?"
16282,Volevano smantellare il MES e alla fine hanno votato come il Partito Democratico.
17891,"Anche a Modena, nonostante la pioggia, le sardine sono tantissime! Un banco coloratissimo sceso in piazza per manifestare contro odio e violenza, per libertà e democrazia."
26028,"""Bella Ciao"" la lascio a Gentiloni e commissari europei, pesciolini e pescioloni: io preferisco la Canzone del Piave: orgoglioso di avere difeso da Ministro i confini e la sicurezza della Patria che ci hanno lasciato i nostri nonni 🇮🇹"
23883,"I Cinquestelle, non sapendo come spiegare la vicenda che coinvolge l'ex Ministro Trenta, e che rappresenta una pietra tombale sulla loro finta lotta alla casta, tornano ad attaccare me per spostare l’attenzione. 

Dicono che sarei assente troppo spesso in Parlamento e quindi non meriterei lo stipendio. Peccato che io risulti tra i primi nella classifica dei deputati più produttivi. Perché guadagnarsi lo stipendio da parlamentare non significa solo schiacciare il bottone, ma studiare, confrontarsi e fare proposte che possano cambiare le cose. 

Ma anche sulla presenza sono pronta a sfidare i colleghi grillini. Perché io anche di lunedì sono quasi sempre in Parlamento, come è giusto che sia, e loro non li ho mai visti. Sapete perché? Perché quando non ci sono votazioni ai parlamentari non viene corrisposto il gettone di presenza. Capito? Quelli che mi fanno la morale vengono in Parlamento solo a pagamento, cioè di solito massimo tre giorni a settimana! 

Facciamo così: che ne dite se ripresento la proposta, già bocciata dai moralisti grillini, di introdurre il cartellino e chiedere a questi fenomeni di venire cinque giorni come i comuni mortali, così vediamo chi lavora davvero e chi schiaccia il bottone a pagamento?"
16445,"🔴 Il Viminale dà il via libera allo sbarco delle navi Alan Kurdi e Ocean Viking, rispettivamente a Messina e Pozzallo.
Porti aperti a tutte le ong, roba da matti. Anzi, da complici."
25990,Chissà chi mi capita oggi di fianco in treno..??😉
23772,In diretta dal “Festival del Lavoro: anteprima 2020”. Seguitemi!
24556,Ma dove l'hanno trovato questo??? Spero che in breve tempo ci libereremo di questi pericolosi incapaci.
26101,"Fioramonti, da ministro dovresti pensare a garantire ai nostri ragazzi scuole efficienti, sicure e pulite. Non blaterare di cannabis per tutti. Ma come si fa? Che brutto messaggio per i giovani. Rifletta sul ruolo che ricopre attualmente e si vergogni."
27039,Cena di gruppo per dimenticare questa vergognosa finanziaria #fratelliditalia #giorgiameloni
27024,Buonanotte amici e grazie a chi mi ha seguito a #nonelarena ❤️
23930,"Il vero scopo della dittatura tecnobancaria in cui ci stanno portando i pentapiddini è mettere le mani nelle tasche dei cittadini: nella manovra hanno previsto pignoramenti dei conti correnti più facili per chi non paga i tributi locali. Quando uno Stato obbliga il cittadino a utilizzare moneta elettronica per poi mettergli le mani in tasca, si va inevitabilmente verso una forma di tirannide. Questo Governo abusivo è una vera sciagura per gli italiani, in Parlamento daremo battaglia per difendere lo Stato di diritto e la libertà dei cittadini!"
23989,"Ammazza la compagna a coltellate perché aspettava un bambino. Solo una parola: BASTARDO.
Solo una pena: galera a vita."
24427,Sono stata invitata ad un interessante convegno che riguarda un tema a cui tengo molto: l’islamizzazione silenziosa.
25702,Vi spiego in tre minuti che cosa si nasconde dietro il continuo attacco della sinistra nei confronti della casa.
16520,Ecco come far perdere il posto ad altre migliaia di lavoratori italiani. Proprio un genio.
16607,"Ma vi pare normale che i rappresentanti di 500 milioni di europei cantino Bella Ciao??? 
Che spettacolo indegno."
16620,"Quando pensi che non possa esserci altro orrore, Bibbiano ti sorprende, in negativo. Se davvero Foti è colpevole di tanta atrocità deve pagare caro, carissimo per le vite rovinate!"
25923,"Chiarissima Giulia Bongiorno, da ascoltare!"
16640,"Proteste oggi in Calabria e Puglia, classici lavoratori portuali🙏"
24645,"Lucia Borgonzoni denunciata alla Corte europea dei diritti dell'Uomo... 
Forza Lucia, su Bibbiano e sugli altri casi, in Emilia-Romagna e in tutta Italia, non riusciranno a tapparci la bocca.
#26gennaiovotoLega #BorgonzoniPresidente"
14530,"Con il governo PD-5Stelle dei porti aperti gli sbarchi sono più che raddoppiati, alla faccia della ""simpatica"" giornalista che non riesce ad ammetterlo, nemmeno di fronte ai dati ufficiali del Viminale!😉 
Scommessa vinta, attendo il caffè! ☕"
26470,"Che squadra questa di Italia Viva!
Tanti auguri di buone feste a tutti voi 💙"
18004,Che rapporti hanno i vertici del M5S con il governo cinese? Tra le cene di Beppe Grillo con l'ambasciatore cinese e i numerosi viaggi ufficiali e non dei grillini in Cina qualcosa non torna. Qualcuno è andato a prendere ordini da uno Stato straniero? Attendiamo risposte dal M5S.
23227,"Carola Rackete sperona la motovedetta della Guardia di Finanza, rischiando di ammazzare i militari a bordo e viene applaudita dalla sinistra italiana e dal Parlamento UE. Matteo Salvini difende i confini del suo paese e viene indagato per sequestro di persona. Che schifo, è il minimo che si possa dire."
23127,"Il 2 dicembre sarò nelle Fiandre, ad Anversa, e questa signora prepara ""mezzi non propriamente pacifici"" (!) contro di me vantando ""una vasta esperienza in questo campo"" (!!). 
Che cosa avrà voluto dire?!?
Alla faccia del dibattito democratico...
Le servirebbe un po' di terapia calmante di #gattiniconSalvini."
